{"gold_ooxml_is_oracle":false,"mce_resolved_package_sha256":"sha256:23a7b1fb4fa07c3ecf386413d71e2c142eccbbb3165bcc257b573f177f531dc6","profile_sha256":"sha256:e2ad051b5aff48e8566bf26d239acf4309619f9b5325497198a97be0e64211ab","schema_version":"1.0","slide_size":{"height":6858000,"width":12192000},"slides":[{"layout_part":"/ppt/slideLayouts/slideLayout1.xml","master_part":"/ppt/slideMasters/slideMaster1.xml","nodes":[{"asset_sha256":null,"bbox":{"height":3600000,"width":3600000,"x":-1080000,"y":-720000},"children":[],"hidden":false,"kind":"shape","native_properties":{"chart_data_summary":null,"chart_type":null,"crop":null,"crop_to_shape":true,"field_type":null,"field_types":[],"fill":{"alpha":null,"color":{"kind":"srgbClr","value":"e8634a"},"kind":"solidFill"},"hyperlink_targets":[],"name":"Intentional Negative Circle","opacity":"1","paragraph_properties":[],"parent_group_path":[],"placeholder_index":null,"placeholder_type":null,"shadow":false,"source_xml_kind":"sp","stroke":{"dash":null,"present":false,"width_emu":0},"subtype":"ellipse","table_dimensions":null},"node_id":"s16:n0","rotation_degrees":"0","source_locator":"/p:sld/p:cSld/p:spTree/p:sp[1]","source_part":"/ppt/slides/slide16.xml","text_runs":[],"z_index":0},{"asset_sha256":null,"bbox":{"height":2160000,"width":4320000,"x":10392120,"y":2160000},"children":[],"hidden":false,"kind":"shape","native_properties":{"chart_data_summary":null,"chart_type":null,"crop":null,"crop_to_shape":false,"field_type":null,"field_types":[],"fill":{"alpha":null,"color":{"kind":"srgbClr","value":"2aacb8"},"kind":"solidFill"},"hyperlink_targets":[],"name":"Intentional Right Bleed","opacity":"1","paragraph_properties":[],"parent_group_path":[],"placeholder_index":null,"placeholder_type":null,"shadow":false,"source_xml_kind":"sp","stroke":{"dash":null,"present":false,"width_emu":0},"subtype":"rect","table_dimensions":null},"node_id":"s16:n1","rotation_degrees":"0","source_locator":"/p:sld/p:cSld/p:spTree/p:sp[2]","source_part":"/ppt/slides/slide16.xml","text_runs":[],"z_index":1},{"asset_sha256":null,"bbox":{"height":1080000,"width":5760000,"x":2880000,"y":-360000},"children":[],"hidden":false,"kind":"shape","native_properties":{"chart_data_summary":null,"chart_type":null,"crop":null,"crop_to_shape":false,"field_type":null,"field_types":[],"fill":{"alpha":null,"color":{"kind":"srgbClr","value":"d4a843"},"kind":"solidFill"},"hyperlink_targets":[],"name":"Intentional Top Bleed","opacity":"1","paragraph_properties":[],"parent_group_path":[],"placeholder_index":null,"placeholder_type":null,"shadow":false,"source_xml_kind":"sp","stroke":{"dash":null,"present":false,"width_emu":0},"subtype":"rect","table_dimensions":null},"node_id":"s16:n2","rotation_degrees":"0","source_locator":"/p:sld/p:cSld/p:spTree/p:sp[3]","source_part":"/ppt/slides/slide16.xml","text_runs":[],"z_index":2},{"asset_sha256":null,"bbox":{"height":1145160,"width":10972800,"x":609480,"y":273600},"children":[],"hidden":false,"kind":"placeholder","native_properties":{"chart_data_summary":null,"chart_type":null,"crop":null,"crop_to_shape":false,"field_type":null,"field_types":[],"fill":{"alpha":null,"color":null,"kind":"noFill"},"hyperlink_targets":[],"name":"PlaceHolder 1","opacity":"1","paragraph_properties":[{"alignment":null,"bullet":null,"indent":null,"level":null,"line_spacing":null,"margin_left":null,"rtl":false,"tab_stops":[]}],"parent_group_path":[],"placeholder_index":null,"placeholder_type":"title","shadow":false,"source_xml_kind":"sp","stroke":{"dash":null,"present":false,"width_emu":0},"subtype":"title","table_dimensions":null},"node_id":"s16:n3","rotation_degrees":"0","source_locator":"/p:sld/p:cSld/p:spTree/p:sp[4]","source_part":"/ppt/slides/slide16.xml","text_runs":[{"bold":true,"font_family":"Carlito","font_size_pt":"36","italic":null,"language":"en-US","rtl":false,"text":"Beyond the Frame"}],"z_index":3},{"asset_sha256":null,"bbox":{"height":648000,"width":5400000,"x":3240000,"y":2340000},"children":[],"hidden":false,"kind":"text","native_properties":{"chart_data_summary":null,"chart_type":null,"crop":null,"crop_to_shape":false,"field_type":null,"field_types":[],"fill":{"alpha":null,"color":null,"kind":"noFill"},"hyperlink_targets":[],"name":"","opacity":"1","paragraph_properties":[{"alignment":"ctr","bullet":{"kind":"buNone","value":null},"indent":null,"level":null,"line_spacing":null,"margin_left":null,"rtl":false,"tab_stops":[]}],"parent_group_path":[],"placeholder_index":null,"placeholder_type":null,"shadow":false,"source_xml_kind":"sp","stroke":{"dash":null,"present":false,"width_emu":0},"subtype":"rect","table_dimensions":null},"node_id":"s16:n4","rotation_degrees":"0","source_locator":"/p:sld/p:cSld/p:spTree/p:sp[5]","source_part":"/ppt/slides/slide16.xml","text_runs":[{"bold":true,"font_family":"Carlito","font_size_pt":"3","italic":null,"language":"en-US","rtl":false,"text":"INTENTIONAL BLEED"}],"z_index":4},{"asset_sha256":null,"bbox":{"height":504000,"width":6480000,"x":2700000,"y":3240000},"children":[],"hidden":false,"kind":"text","native_properties":{"chart_data_summary":null,"chart_type":null,"crop":null,"crop_to_shape":false,"field_type":null,"field_types":[],"fill":{"alpha":null,"color":null,"kind":"noFill"},"hyperlink_targets":[],"name":"","opacity":"1","paragraph_properties":[{"alignment":"ctr","bullet":{"kind":"buNone","value":null},"indent":null,"level":null,"line_spacing":null,"margin_left":null,"rtl":false,"tab_stops":[]}],"parent_group_path":[],"placeholder_index":null,"placeholder_type":null,"shadow":false,"source_xml_kind":"sp","stroke":{"dash":null,"present":false,"width_emu":0},"subtype":"rect","table_dimensions":null},"node_id":"s16:n5","rotation_degrees":"0","source_locator":"/p:sld/p:cSld/p:spTree/p:sp[6]","source_part":"/ppt/slides/slide16.xml","text_runs":[{"bold":false,"font_family":"Liberation Sans","font_size_pt":"16","italic":null,"language":"en-US","rtl":false,"text":"Negative coordinates are part of the composition."}],"z_index":5},{"asset_sha256":null,"bbox":{"height":0,"width":0,"x":0,"y":0},"children":[],"hidden":false,"kind":"placeholder","native_properties":{"chart_data_summary":null,"chart_type":null,"crop":null,"crop_to_shape":false,"field_type":null,"field_types":[],"fill":{"alpha":null,"color":null,"kind":"inherited"},"hyperlink_targets":[],"name":"PlaceHolder 2","opacity":"1","paragraph_properties":[{"alignment":null,"bullet":null,"indent":null,"level":null,"line_spacing":null,"margin_left":null,"rtl":false,"tab_stops":[]}],"parent_group_path":[],"placeholder_index":1,"placeholder_type":"ftr","shadow":false,"source_xml_kind":"sp","stroke":{"dash":null,"present":false,"width_emu":null},"subtype":"ftr","table_dimensions":null},"node_id":"s16:n6","rotation_degrees":"0","source_locator":"/p:sld/p:cSld/p:spTree/p:sp[7]","source_part":"/ppt/slides/slide16.xml","text_runs":[{"bold":null,"font_family":null,"font_size_pt":null,"italic":null,"language":null,"rtl":false,"text":"Gloss Benchmark v1"}],"z_index":6},{"asset_sha256":null,"bbox":{"height":0,"width":0,"x":0,"y":0},"children":[],"hidden":false,"kind":"placeholder","native_properties":{"chart_data_summary":null,"chart_type":null,"crop":null,"crop_to_shape":false,"field_type":"slidenum","field_types":["slidenum"],"fill":{"alpha":null,"color":null,"kind":"inherited"},"hyperlink_targets":[],"name":"PlaceHolder 3","opacity":"1","paragraph_properties":[{"alignment":null,"bullet":null,"indent":null,"level":null,"line_spacing":null,"margin_left":null,"rtl":false,"tab_stops":[]}],"parent_group_path":[],"placeholder_index":2,"placeholder_type":"sldNum","shadow":false,"source_xml_kind":"sp","stroke":{"dash":null,"present":false,"width_emu":null},"subtype":"sldNum","table_dimensions":null},"node_id":"s16:n7","rotation_degrees":"0","source_locator":"/p:sld/p:cSld/p:spTree/p:sp[8]","source_part":"/ppt/slides/slide16.xml","text_runs":[{"bold":null,"font_family":null,"font_size_pt":null,"italic":null,"language":null,"rtl":false,"text":"16"}],"z_index":7}],"part_name":"/ppt/slides/slide16.xml","relationships":[{"id":"rId1","target":"/ppt/slideLayouts/slideLayout1.xml","target_mode":"Internal","type":"http://schemas.openxmlformats.org/officeDocument/2006/relationships/slideLayout"}],"slide":16}],"units":"EMU"}